{
  "verdict": "revision_needed",
  "overall_assessment": "Solid structure but a critical insecure deserialization vulnerability must be fixed before approval.",
  "quality_scores": { "correctness": 6, "code_quality": 7, "test_coverage": 5, "spec_adherence": 7 },
  "issues": [
    {
      "severity": "critical",
      "category": "security",
      "file_path": "src/services/deserialize.rs",
      "line_range": "20-35",
      "description": "Insecure deserialization of untrusted data.",
      "suggested_fix": "Validate input before deserialization; use safe deserialization formats with strict schema enforcement."
    }
  ],
  "strengths": ["Clear handler structure", "Good error messages"],
  "feedback": {
    "critical_issues": [
      {
        "severity": "critical",
        "category": "security",
        "file_path": "src/services/deserialize.rs",
        "line_range": "20-35",
        "description": "Insecure deserialization of untrusted data.",
        "suggested_fix": "Validate input before deserialization; use safe deserialization formats with strict schema enforcement."
      }
    ],
    "guidance": "Add input validation and use safe deserialization before resubmitting.",
    "keep_unchanged": ["handler routing"],
    "revision_round": 0
  },
  "red_reconciliation": [
    {
      "challenge_id": "R1",
      "disposition": "upheld",
      "rationale": "Confirmed: untrusted data is deserialized without validation. Blocking on this."
    }
  ]
}
