{
  "verdict": "revision_needed",
  "overall_assessment": "Functional implementation but a critical type mismatch must be fixed before approval.",
  "quality_scores": { "correctness": 6, "code_quality": 7, "test_coverage": 5, "spec_adherence": 7 },
  "issues": [
    {
      "severity": "critical",
      "category": "correctness",
      "file_path": "src/services/temperature.rs",
      "line_range": "12-22",
      "description": "Type mismatch in temperature conversion (int vs float).",
      "suggested_fix": "Use consistent float types for temperature conversion calculations."
    }
  ],
  "strengths": ["Clear handler structure", "Good error messages"],
  "feedback": {
    "critical_issues": [
      {
        "severity": "critical",
        "category": "correctness",
        "file_path": "src/services/temperature.rs",
        "line_range": "12-22",
        "description": "Type mismatch in temperature conversion (int vs float).",
        "suggested_fix": "Use consistent float types for temperature conversion calculations."
      }
    ],
    "guidance": "Fix the type mismatch by using consistent float types before resubmitting.",
    "keep_unchanged": ["handler routing"],
    "revision_round": 0
  },
  "red_reconciliation": [
    {
      "challenge_id": "R1",
      "disposition": "upheld",
      "rationale": "Confirmed: integer and float types are mixed in conversion. Blocking on this."
    }
  ]
}
