{
  "verdict": "revision_needed",
  "overall_assessment": "Solid structure but a critical stale reference bug must be fixed before approval.",
  "quality_scores": { "correctness": 6, "code_quality": 7, "test_coverage": 5, "spec_adherence": 7 },
  "issues": [
    {
      "severity": "critical",
      "category": "correctness",
      "file_path": "src/services/cache.rs",
      "line_range": "18-30",
      "description": "Stale reference to expired cache entry.",
      "suggested_fix": "Validate cache entry freshness before using the cached data."
    }
  ],
  "strengths": ["Clear handler structure", "Good error messages"],
  "feedback": {
    "critical_issues": [
      {
        "severity": "critical",
        "category": "correctness",
        "file_path": "src/services/cache.rs",
        "line_range": "18-30",
        "description": "Stale reference to expired cache entry.",
        "suggested_fix": "Validate cache entry freshness before using the cached data."
      }
    ],
    "guidance": "Add cache entry freshness validation before resubmitting.",
    "keep_unchanged": ["handler routing"],
    "revision_round": 0
  },
  "red_reconciliation": [
    {
      "challenge_id": "R1",
      "disposition": "upheld",
      "rationale": "Confirmed: expired cache entries are used without validation. Blocking on this."
    }
  ]
}
