{
  "verdict": "approved",
  "overall_assessment": "Trims surrounding whitespace and lowercases the input, matching the request exactly. No behaviour to flag.",
  "quality_scores": {
    "correctness": 8,
    "code_quality": 8,
    "test_coverage": 7,
    "spec_adherence": 8
  },
  "issues": [],
  "strengths": [
    "Matches the requested behaviour."
  ]
}
