{
  "verdict": "revision_needed",
  "overall_assessment": "Functional implementation but a critical hardcoded secret must be removed before approval.",
  "quality_scores": {
    "correctness": 6,
    "code_quality": 7,
    "test_coverage": 5,
    "spec_adherence": 7
  },
  "issues": [
    {
      "severity": "critical",
      "category": "security",
      "file_path": "src/config/api.rs",
      "line_range": "5-12",
      "description": "Hardcoded secret: an API key committed in source code.",
      "suggested_fix": "Move secrets to environment variables or a secrets manager."
    }
  ],
  "strengths": [
    "Clear handler structure",
    "Good error messages"
  ],
  "feedback": {
    "critical_issues": [
      {
        "severity": "critical",
        "category": "security",
        "file_path": "src/config/api.rs",
        "line_range": "5-12",
        "description": "Hardcoded API key in source code.",
        "suggested_fix": "Move secrets to environment variables or a secrets manager."
      }
    ],
    "guidance": "Remove the hardcoded secret and use environment variables before resubmitting.",
    "keep_unchanged": [
      "handler routing"
    ],
    "revision_round": 0
  },
  "red_reconciliation": [
    {
      "challenge_id": "R1",
      "disposition": "upheld",
      "rationale": "Confirmed: API key is hardcoded in source. Blocking on this."
    }
  ]
}
