{
  "verdict": "revision_needed",
  "overall_assessment": "Solid structure but a critical max integer overflow must be fixed before approval.",
  "quality_scores": { "correctness": 6, "code_quality": 7, "test_coverage": 5, "spec_adherence": 7 },
  "issues": [
    {
      "severity": "critical",
      "category": "boundary",
      "file_path": "src/services/arithmetic.rs",
      "line_range": "14-24",
      "description": "Integer overflow at max value boundary.",
      "suggested_fix": "Add boundary checks before performing arithmetic operations."
    }
  ],
  "strengths": ["Clear handler structure", "Good error messages"],
  "feedback": {
    "critical_issues": [
      {
        "severity": "critical",
        "category": "boundary",
        "file_path": "src/services/arithmetic.rs",
        "line_range": "14-24",
        "description": "Integer overflow at max value boundary.",
        "suggested_fix": "Add boundary checks before performing arithmetic operations."
      }
    ],
    "guidance": "Add boundary checks for max integer values before resubmitting.",
    "keep_unchanged": ["handler routing"],
    "revision_round": 0
  },
  "red_reconciliation": [
    {
      "challenge_id": "R1",
      "disposition": "upheld",
      "rationale": "Confirmed: arithmetic operations do not check for max integer boundaries. Blocking on this."
    }
  ]
}
