{
  "verdict": "revision_needed",
  "overall_assessment": "Solid structure but a critical null dereference bug must be fixed before approval.",
  "quality_scores": { "correctness": 6, "code_quality": 7, "test_coverage": 5, "spec_adherence": 7 },
  "issues": [
    {
      "severity": "critical",
      "category": "logic",
      "file_path": "src/handlers/user.rs",
      "line_range": "25-38",
      "description": "Null pointer dereference when user not found.",
      "suggested_fix": "Check for null/None before dereferencing the user result."
    }
  ],
  "strengths": ["Clear handler structure", "Good error messages"],
  "feedback": {
    "critical_issues": [
      {
        "severity": "critical",
        "category": "logic",
        "file_path": "src/handlers/user.rs",
        "line_range": "25-38",
        "description": "Null pointer dereference when user not found.",
        "suggested_fix": "Check for null/None before dereferencing the user result."
      }
    ],
    "guidance": "Add null check before dereferencing user result before resubmitting.",
    "keep_unchanged": ["handler routing"],
    "revision_round": 0
  },
  "red_reconciliation": [
    {
      "challenge_id": "R1",
      "disposition": "upheld",
      "rationale": "Confirmed: user lookup result is dereferenced without null check. Blocking on this."
    }
  ]
}
