{
  "verdict": "revision_needed",
  "overall_assessment": "Solid structure but a critical race condition must be fixed before approval.",
  "quality_scores": { "correctness": 6, "code_quality": 7, "test_coverage": 5, "spec_adherence": 7 },
  "issues": [
    {
      "severity": "critical",
      "category": "logic",
      "file_path": "src/services/counter.rs",
      "line_range": "8-22",
      "description": "Race condition in concurrent counter increment.",
      "suggested_fix": "Use atomic operations or mutex locking for concurrent counter access."
    }
  ],
  "strengths": ["Clear handler structure", "Good error messages"],
  "feedback": {
    "critical_issues": [
      {
        "severity": "critical",
        "category": "logic",
        "file_path": "src/services/counter.rs",
        "line_range": "8-22",
        "description": "Race condition in concurrent counter increment.",
        "suggested_fix": "Use atomic operations or mutex locking for concurrent counter access."
      }
    ],
    "guidance": "Use atomic operations for concurrent counter access before resubmitting.",
    "keep_unchanged": ["handler routing"],
    "revision_round": 0
  },
  "red_reconciliation": [
    {
      "challenge_id": "R1",
      "disposition": "upheld",
      "rationale": "Confirmed: counter is incremented without synchronization. Blocking on this."
    }
  ]
}
