{
  "verdict": "revision_needed",
  "overall_assessment": "Off-by-one in the slice bound needs fixing before approval.",
  "quality_scores": { "correctness": 7, "code_quality": 8, "test_coverage": 6, "spec_adherence": 8 },
  "issues": [
    {
      "severity": "major",
      "category": "logic",
      "file_path": "src/list.rs",
      "line_range": "28-32",
      "description": "Off-by-one: the slice upper bound drops the final page item.",
      "suggested_fix": "Use end = start + size, not start + size - 1."
    }
  ],
  "strengths": ["Pagination wired up"],
  "feedback": {
    "critical_issues": [
      {
        "severity": "major",
        "category": "logic",
        "file_path": "src/list.rs",
        "line_range": "28-32",
        "description": "Off-by-one in slice bound.",
        "suggested_fix": "Fix the bound."
      }
    ],
    "guidance": "Fix the off-by-one before resubmitting.",
    "keep_unchanged": ["route"],
    "revision_round": 0
  },
  "red_reconciliation": [
    {
      "challenge_id": "R1",
      "disposition": "upheld",
      "rationale": "Confirmed: the bound excludes the last item."
    }
  ]
}
