{
  "verdict": "revision_needed",
  "overall_assessment": "Functional implementation but a critical command injection vulnerability must be fixed before approval.",
  "quality_scores": { "correctness": 6, "code_quality": 7, "test_coverage": 5, "spec_adherence": 7 },
  "issues": [
    {
      "severity": "critical",
      "category": "security",
      "file_path": "src/services/shell.rs",
      "line_range": "10-25",
      "description": "Command injection via unsanitized user input in shell command.",
      "suggested_fix": "Use parameterized command execution or validate/sanitize input before passing to shell."
    }
  ],
  "strengths": ["Clear handler structure", "Good error messages"],
  "feedback": {
    "critical_issues": [
      {
        "severity": "critical",
        "category": "security",
        "file_path": "src/services/shell.rs",
        "line_range": "10-25",
        "description": "Command injection via unsanitized user input in shell command.",
        "suggested_fix": "Use parameterized command execution or validate/sanitize input before passing to shell."
      }
    ],
    "guidance": "Sanitize user input before passing to shell commands before resubmitting.",
    "keep_unchanged": ["handler routing"],
    "revision_round": 0
  },
  "red_reconciliation": [
    {
      "challenge_id": "R1",
      "disposition": "upheld",
      "rationale": "Confirmed: user input is interpolated directly into a shell command string. Blocking on this."
    }
  ]
}
