{
  "verdict": "revision_needed",
  "overall_assessment": "Solid structure but a critical SQL injection must be fixed before approval.",
  "quality_scores": { "correctness": 6, "code_quality": 7, "test_coverage": 5, "spec_adherence": 8 },
  "issues": [
    {
      "severity": "critical",
      "category": "security",
      "file_path": "src/auth/login.rs",
      "line_range": "42-58",
      "description": "SQL injection: the query is built by string concatenation instead of a parameterized statement.",
      "suggested_fix": "Use a prepared statement with bound parameters."
    }
  ],
  "strengths": ["Clear handler structure", "Good error messages"],
  "feedback": {
    "critical_issues": [
      {
        "severity": "critical",
        "category": "security",
        "file_path": "src/auth/login.rs",
        "line_range": "42-58",
        "description": "SQL injection via string concatenation.",
        "suggested_fix": "Parameterize the query."
      }
    ],
    "guidance": "Parameterize the login query before resubmitting.",
    "keep_unchanged": ["handler routing"],
    "revision_round": 0
  },
  "red_reconciliation": [
    {
      "challenge_id": "R1",
      "disposition": "upheld",
      "rationale": "Confirmed: the query is concatenated, not parameterized. Blocking on this."
    }
  ]
}
