{
  "verdict": "revision_needed",
  "overall_assessment": "Solid structure but a critical XSS vulnerability must be fixed before approval.",
  "quality_scores": {
    "correctness": 6,
    "code_quality": 7,
    "test_coverage": 5,
    "spec_adherence": 7
  },
  "issues": [
    {
      "severity": "critical",
      "category": "security",
      "file_path": "src/handlers/render.rs",
      "line_range": "18-32",
      "description": "XSS: cross-site scripting via unescaped HTML output.",
      "suggested_fix": "Escape all user-controlled data before inserting into HTML responses."
    }
  ],
  "strengths": [
    "Clear handler structure",
    "Good error messages"
  ],
  "feedback": {
    "critical_issues": [
      {
        "severity": "critical",
        "category": "security",
        "file_path": "src/handlers/render.rs",
        "line_range": "18-32",
        "description": "Cross-site scripting via unescaped HTML output.",
        "suggested_fix": "Escape all user-controlled data before inserting into HTML responses."
      }
    ],
    "guidance": "Escape user-controlled output to prevent XSS before resubmitting.",
    "keep_unchanged": [
      "handler routing"
    ],
    "revision_round": 0
  },
  "red_reconciliation": [
    {
      "challenge_id": "R1",
      "disposition": "upheld",
      "rationale": "Confirmed: user input is rendered into HTML without escaping. Blocking on this."
    }
  ]
}
