{
  "verdict": "approved",
  "overall_assessment": "Fields are typed, defaults are applied, and the constructor rejects invalid input.",
  "quality_scores": {
    "correctness": 9,
    "code_quality": 9,
    "test_coverage": 8,
    "spec_adherence": 9
  },
  "issues": [],
  "strengths": [
    "Validation happens at construction"
  ]
}
