{
  "verdict": "approved",
  "overall_assessment": "Offset and limit are bounds-checked before use and the response carries page metadata.",
  "quality_scores": {
    "correctness": 9,
    "code_quality": 9,
    "test_coverage": 8,
    "spec_adherence": 9
  },
  "issues": [],
  "strengths": [
    "Bounds are checked before the query"
  ]
}
