{
  "verdict": "revision_needed",
  "overall_assessment": "Solid structure but a critical infinite loop must be fixed before approval.",
  "quality_scores": { "correctness": 6, "code_quality": 7, "test_coverage": 5, "spec_adherence": 7 },
  "issues": [
    {
      "severity": "critical",
      "category": "logic",
      "file_path": "src/services/retry.rs",
      "line_range": "10-28",
      "description": "Infinite loop when retry count reaches zero.",
      "suggested_fix": "Add a bounds check or decrement the retry counter properly."
    }
  ],
  "strengths": ["Clear handler structure", "Good error messages"],
  "feedback": {
    "critical_issues": [
      {
        "severity": "critical",
        "category": "logic",
        "file_path": "src/services/retry.rs",
        "line_range": "10-28",
        "description": "Infinite loop when retry count reaches zero.",
        "suggested_fix": "Add a bounds check or decrement the retry counter properly."
      }
    ],
    "guidance": "Fix the loop termination condition before resubmitting.",
    "keep_unchanged": ["handler routing"],
    "revision_round": 0
  },
  "red_reconciliation": [
    {
      "challenge_id": "R1",
      "disposition": "upheld",
      "rationale": "Confirmed: retry loop never terminates when count is zero. Blocking on this."
    }
  ]
}
