{
  "verdict": "revision_needed",
  "overall_assessment": "Solid structure but a critical missing validation must be fixed before approval.",
  "quality_scores": { "correctness": 6, "code_quality": 7, "test_coverage": 5, "spec_adherence": 7 },
  "issues": [
    {
      "severity": "critical",
      "category": "correctness",
      "file_path": "src/handlers/register.rs",
      "line_range": "12-24",
      "description": "Missing email format validation.",
      "suggested_fix": "Add email format validation before processing the registration."
    }
  ],
  "strengths": ["Clear handler structure", "Good error messages"],
  "feedback": {
    "critical_issues": [
      {
        "severity": "critical",
        "category": "correctness",
        "file_path": "src/handlers/register.rs",
        "line_range": "12-24",
        "description": "Missing email format validation.",
        "suggested_fix": "Add email format validation before processing the registration."
      }
    ],
    "guidance": "Add email format validation before resubmitting.",
    "keep_unchanged": ["handler routing"],
    "revision_round": 0
  },
  "red_reconciliation": [
    {
      "challenge_id": "R1",
      "disposition": "upheld",
      "rationale": "Confirmed: email is accepted without format validation. Blocking on this."
    }
  ]
}
