{
  "verdict": "revision_needed",
  "overall_assessment": "Functional implementation but a critical empty input check must be fixed before approval.",
  "quality_scores": { "correctness": 6, "code_quality": 7, "test_coverage": 5, "spec_adherence": 7 },
  "issues": [
    {
      "severity": "critical",
      "category": "boundary",
      "file_path": "src/handlers/input.rs",
      "line_range": "8-18",
      "description": "Missing empty string check causing panic.",
      "suggested_fix": "Add empty string validation before processing the input."
    }
  ],
  "strengths": ["Clear handler structure", "Good error messages"],
  "feedback": {
    "critical_issues": [
      {
        "severity": "critical",
        "category": "boundary",
        "file_path": "src/handlers/input.rs",
        "line_range": "8-18",
        "description": "Missing empty string check causing panic.",
        "suggested_fix": "Add empty string validation before processing the input."
      }
    ],
    "guidance": "Add empty string validation before resubmitting.",
    "keep_unchanged": ["handler routing"],
    "revision_round": 0
  },
  "red_reconciliation": [
    {
      "challenge_id": "R1",
      "disposition": "upheld",
      "rationale": "Confirmed: empty string input is not checked and causes panic. Blocking on this."
    }
  ]
}
