{
  "verdict": "revision_needed",
  "overall_assessment": "Functional implementation but a critical uninitialized variable bug must be fixed before approval.",
  "quality_scores": { "correctness": 6, "code_quality": 7, "test_coverage": 5, "spec_adherence": 7 },
  "issues": [
    {
      "severity": "critical",
      "category": "logic",
      "file_path": "src/services/cache.rs",
      "line_range": "14-26",
      "description": "Use of uninitialized variable in cache lookup.",
      "suggested_fix": "Initialize the variable with a default value or handle the uninitialized state."
    }
  ],
  "strengths": ["Clear handler structure", "Good error messages"],
  "feedback": {
    "critical_issues": [
      {
        "severity": "critical",
        "category": "logic",
        "file_path": "src/services/cache.rs",
        "line_range": "14-26",
        "description": "Use of uninitialized variable in cache lookup.",
        "suggested_fix": "Initialize the variable with a default value or handle the uninitialized state."
      }
    ],
    "guidance": "Initialize the variable before use before resubmitting.",
    "keep_unchanged": ["handler routing"],
    "revision_round": 0
  },
  "red_reconciliation": [
    {
      "challenge_id": "R1",
      "disposition": "upheld",
      "rationale": "Confirmed: variable is used before initialization. Blocking on this."
    }
  ]
}
