{
  "verdict": "revision_needed",
  "overall_assessment": "Functional implementation but a critical log injection vulnerability must be fixed before approval.",
  "quality_scores": { "correctness": 6, "code_quality": 7, "test_coverage": 5, "spec_adherence": 7 },
  "issues": [
    {
      "severity": "critical",
      "category": "security",
      "file_path": "src/logging/logger.rs",
      "line_range": "12-22",
      "description": "Log injection via unsanitized user input in log messages.",
      "suggested_fix": "Sanitize user input before including it in log messages."
    }
  ],
  "strengths": ["Clear handler structure", "Good error messages"],
  "feedback": {
    "critical_issues": [
      {
        "severity": "critical",
        "category": "security",
        "file_path": "src/logging/logger.rs",
        "line_range": "12-22",
        "description": "Log injection via unsanitized user input in log messages.",
        "suggested_fix": "Sanitize user input before including it in log messages."
      }
    ],
    "guidance": "Sanitize user input before including in log messages before resubmitting.",
    "keep_unchanged": ["handler routing"],
    "revision_round": 0
  },
  "red_reconciliation": [
    {
      "challenge_id": "R1",
      "disposition": "upheld",
      "rationale": "Confirmed: user input is interpolated directly into log strings. Blocking on this."
    }
  ]
}
